{
  "schema_version": "2026-05-29",
  "document_type": "tenant_availability",
  "tenant_id": "tenant_demo",
  "availability_id": "default",
  "timezone": "America/Denver",
  "slot_interval_minutes": 30,
  "lead_time_minutes": 60,
  "buffer_before_minutes": 0,
  "buffer_after_minutes": 0,
  "weekly_hours": [
    { "day": "mon", "enabled": true, "start_time": "08:00", "end_time": "18:00" },
    { "day": "tue", "enabled": true, "start_time": "08:00", "end_time": "18:00" },
    { "day": "wed", "enabled": true, "start_time": "08:00", "end_time": "18:00" },
    { "day": "thu", "enabled": true, "start_time": "08:00", "end_time": "18:00" },
    { "day": "fri", "enabled": true, "start_time": "08:00", "end_time": "18:00" },
    { "day": "sat", "enabled": false, "start_time": "08:00", "end_time": "18:00" },
    { "day": "sun", "enabled": false, "start_time": "08:00", "end_time": "18:00" }
  ],
  "updated_at": 1780092000
}
